{
  "$schema" : "http://json-schema.org/draft-07/schema#",
  "type" : "object",
  "properties" : {
    "description" : {
      "type" : "string"
    },
    "id" : {
      "type" : "string"
    },
    "processors" : {
      "type" : "array",
      "items" : {
        "type" : "object",
        "properties" : {
          "clazz" : {
            "type" : "string"
          },
          "description" : {
            "type" : "string"
          },
          "properties" : {
            "type" : "object"
          }
        }
      }
    },
    "stateDefinitions" : {
      "type" : "array",
      "items" : {
        "type" : "object",
        "properties" : {
          "description" : {
            "type" : "string"
          },
          "name" : {
            "type" : "string"
          },
          "processors" : {
            "type" : "array",
            "items" : {
              "type" : "string"
            }
          }
        }
      }
    },
    "transitions" : {
      "type" : "array",
      "items" : {
        "type" : "object",
        "properties" : {
          "fromState" : {
            "type" : "string"
          },
          "toState" : {
            "type" : "array",
            "items" : {
              "type" : "string"
            }
          }
        }
      }
    }
  }
}